Japanese Name,English Name,Id,Adjusted Id,Icon,Normal Quality,High Quality,Normal Quality RP,High Quality RP,Linked Inner,HQ Linked Inner,Sounds,Cast Sounds,Material Anim,Material Anim Ex,Hand Textures,HQ Hand Textures
なし,None,0,0,,1b305897f5c710a75704e24565bc5f42,,,,,,,,,,,
胸毛,Chest Hair,1,0,,19469fe0ed86026982a77de0e2e8e811,,,,,,,,,,,
タトゥー,Tattoos,2,0,,d3b0ec078eab4bb0e392d8e8fbc0f898,,,,,,,,,,,
胸のキズ,Chest Scar,3,0,,ffb19aa7347793c0385e82f31a39ff83,,,,,,,,,,,
アンダーアーマー,Under Armor,4,0,,198b30f1c8fb3fdd6224f8668991ebbd,,,,,,,,,,,
バンデージ,Bandages,5,0,,bdbe7864cd5d7abdd475a833a43099ba,,,,,,,,,,,
,,6,0,,7031db373d1648f8e2e74fc41ed6d1fc,,,,,,,,,,,
,,10,0,,,,,,,,,,,,,
,,11,0,,,,,,,,,,,,,
,,12,0,,,,,,,,,,,,,
ショルダーウィングＭ,Shoulder Wings M,20,0,,d3fc5e5713745c01f622139f293b3119,,,,,,,,,,,
パイレーツＭタトゥーＡ,Pirate M Tattoo A,30,0,,b9d4e4e05eb5508ab403f29ef3928293,,,,,,,,,,,
パイレーツＭタトゥーＢ,Pirate M Tattoo B,31,0,,3e376ca51fecf6d58447488274c79c96,,,,,,,,,,,
パイレーツＭタトゥーＣ,Pirate M Tattoo C,40,0,,559cf0f179e5f5a535c954c9b4a4adbc,,,,,,,,,,,
パイレーツＭタトゥーＤ,Pirate M Tattoo D,41,0,,118aeebeb786c222793f7695c763e116,,,,,,,,,,,
ヴォルドラタトゥーＭ,Vol Dragon Tattoo M,50,0,,a6853b72c3b97276f41a876f18c68f63,,,,,,,,,,,
アギニスタトゥーＭ,Agnis Tattoo M,60,0,,d673fb93053e5ab3fa90637a6f953057,,,,,,,,,,,
指ぬきグローブＭ　黒,Fingerless Gloves M: Black,70,0,,aa391b1b3c0ccbb20ccf3728115c0b3f,,,,,,,,,,,
指ぬきグローブＭ　赤,Fingerless Gloves M: Red,71,0,,4df1d3404cbedb2a1738d3fac9a06914,,,,,,,,,,,
指ぬきグローブＭ　白,Fingerless Gloves M: White,72,0,,528029229bba45a7e697a632adfbc7de,,,,,,,,,,,
バル・ロドスタトゥー,Bar Lodos Tattoo,80,0,,1105ec898c6106c34c0e4a58efc1c342,,,,,,,,,,,
ショルダータトゥーＭ,Shoulder Tattoo M,90,0,,d3d40f4be9c001e36c2b5246d118fa22,,,,,,,,,,,
ショルダータトゥーＭ　青,Shoulder Tattoo M: Blue,91,0,,f5c3ce36559acfc1c2ece553603a8796,,,,,,,,,,,
レントゲンペイントＭ,X-Ray Paint M,100,0,,2d52f4fda999b8789a245d5bd27dd2cb,,,,,,,,,,,
ブレイズペイントＭ　青,Blaze Paint M: Blue,110,0,,2422af1ba5a41fda2bf9a48aceaedb84,,,,,,,,,,,
ブレイズペイントＭ　紫,Blaze Paint M: Purple,111,0,,d860d8c2141fd24d651bec379677ff93,,,,,,,,,,,
ブレイズペイントＭ　赤,Blaze Paint M: Red,112,0,,760495f40eb846129d6262ff08900ad1,,,,,,,,,,,
全身タイツＭ　赤,Full-Body Tights M: Red,120,0,,1b76be62ab536c17e75c3a4b4ec441ba,,,,,,,,,,,
全身タイツＭ　青,Full-Body Tights M: Blue,121,0,,753d59d3b9487163c92f2451dd3ff79d,,,,,,,,,,,
全身タイツＭ　緑,Full-Body Tights M: Green,122,0,,00073a21bfd2f8b87e3e20972c5b794f,,,,,,,,,,,
全身タイツＭ　白,Bodystocking M: White,123,0,,c4309c84f39f9a83005f9df527e9cb3c,,,,,,,,,,,
全身タイツＭ　黒,Bodystocking M: Black,124,0,,7c59808e4e9371dc13200b7e58a1c307,,,,,,,,,,,
全身タイツＭ　メタル,Bodystocking M: Metal,125,0,,52db3e39e1ee3f030d1ba5665f1b591d,,,,,,,,,,,
電撃ソックス,,130,0,,bf3f9280f4a19c117364b52742ef8fc4,,,,,,,,,,,
オウガタトゥー,Ogre Tattoo,140,0,,0d8119a9506f962c2b7f6876066c312f,,,,,,,,,,,
オウガタトゥー　赤,Ogre Tattoo: Red,141,0,,f4edce607b1acf3f6347846b5b2beb1a,,,,,,,,,,,
足袋＆手袋Ｍ　白,Socks & Gloves M: White,150,0,,3ef97fb5362c14db7a924817a74b82fa,,,,,,,,,,,
足袋＆手袋Ｍ　黒,Socks & Gloves M: Black,151,0,,e0c5241c09c8a248e8f4479fc5d04fb2,,,,,,,,,,,
足袋Ｍ　白,Socks M: White,160,0,,9d287edf3d670f6ca5ba6ce1ca093108,,,,,,,,,,,
足袋Ｍ　黒,Socks M: Black,161,0,,fef5356879685d5fb366912b51fed0d8,,,,,,,,,,,
パープルローズタトゥーＭ,Purple Rose Tattoo M,170,0,,484b500a762f5b64ffe38b2346de7ea0,,,,,,,,,,,
レッドローズタトゥーＭ,Red Rose Tattoo M,171,0,,e7a588c4929af30222e7611712831da9,,,,,,,,,,,
スクールソックスＭ　白,School Tights M: White,180,0,,936c740b30fbfa4106871dcc1bd8202b,,,,,,,,,,,
スクールソックスＭ　黒,School Tights M: Black,181,0,,35cb6ce47c1ed8ad124e9f3770f59e64,,,,,,,,,,,
,,190,0,,,,,,,,,,,,,
,,191,0,,,,,,,,,,,,,
アンカータトゥーＭ,Anchor Tattoo M,200,0,,8ba01f8c151e66395f03371577eba8de,,,,,,,,,,,
腕包帯Ｍ,Arm Bandage M,210,0,,d384c83a2407be3e9dbefad11c69cb7f,,,,,,,,,,,
ラインペイントＭ,Line Paint M,220,0,,27c28781203f52735ef71a585c60c63b,,,,,,,,,,,
クロームタトゥーＭ,Chrome Tattoo M,230,0,,9f61934aae367cfcd465f2c7b1b38a75,,,,,,,,,,,
オガルタトゥーＭ,Ogal Tattoo M,240,0,,4945dc765f32547a47b43cf670dd6cc4,,,,,,,,,,,
レッグバンテージＭ,Leg Bandage M,250,0,,9e55f34bd9bc5f091412fb420966c053,,,,,,,,,,,
アジャイルタトゥー,Agile Tattoo,260,0,,3d33d0c4e72f297fb0193c716c208287,,,,,,,,,,,
ファスナーペイントＭ,Zipper Paint M,270,0,,f46af664010959d3de140518e8a9cf31,,,,,,,,,,,
ムーンタトゥーＭ,Moon Tattoo M,280,0,,f873183bbdd0b82084b55a03b684d1a1,,,,,,,,,,,
ハートタトゥーＭ,Heart Tattoo M,290,0,,a912ffbfeb13596a86a3bbc2a1c6ad68,,,,,,,,,,,
サークルタトゥーＭ,Sun Tattoo M,300,0,,87d0b10bcc26cfa211e40f9520252138,,,,,,,,,,,
シーリスペイントＭ,Night Sea Paint M,310,0,,f6bcd3fb09b8677d1ae4eeee618305bc,,,,,,,,,,,
喧嘩屋サラシＭ,Fighter's Cloth M,320,0,,df9e8369e459bbb8c2dfa95e3378e24a,,,,,,,,,,,
アイエフタイツＭ,,330,0,,66c740b52dad2e4f2312ef0c6f475230,,,,,,,,,,,
メカ関節風ペイントＭ,Mech Joint Paint M,340,0,,8814f1e49699c732a134348ba8551301,,,,,,,,,,,
,,350,0,,,,,,,,,,,,,
,,360,0,,25cbe953e9723eee2c5d0e43ac9a5174,,,,,,,,,,,
ストレイトグローブ,Biker Gloves,370,0,,f8604e1794e4be949bcab51cacd64d1f,,,,,,,,,,,
,,380,0,,6263f0182e65e8644e995986935ee307,,,,,,,,,,,
Spats M: Black,,390,0,,,,,,,,,,,,,
Spats M: White,,391,0,,,,,,,,,,,,,
Spats M: Navy,,392,0,,,,,,,,,,,,,
Spats M: Red,,393,0,,,,,,,,,,,,,
アステリアグローブＭ,Asteria Gloves M,400,0,,ab703845edf4837664689ec92eca92ab,,,,,,,,,,,
ショートスパッツＭ　黒,Short Spats M: Black,410,0,,bc1ee3a81892c1087e63ac997cdd40a2,,,,,,,,,,,
ショートスパッツＭ　白,Short Spats M: White,411,0,,872bbcb4632182e40fdf0620c7ac4ce9,,,,,,,,,,,
ショートスパッツＭ　紺,Short Spats M: Navy,412,0,,febcd1638a0b05b1cf2027de0873fb3c,,,,,,,,,,,
ショートスパッツＭ　赤,Short Spats M: Red,413,0,,b9419f81c54b012e7fd6c1443b02b743,,,,,,,,,,,
スポーツリブソックスＭ,Sports Rib Socks M,420,0,,ef4ff5c6c4f60e32e43150b35cf535c2,,,,,,,,,,,
カブキテッコウＭ,Kabuki Tekko Gloves M,430,0,,0fa9ca70136171e8cbf80dc1fe154c70,,,,,,,,,,,
バックウィングＭ　黒,Back Wings M: Black,440,0,,c6f523e34701fb11527075de30ff494b,,,,,,,,,,,
バックウィングＭ　白,Back Wings M: White,441,0,,3d17218fd0b8948fb45ca72e76b405d1,,,,,,,,,,,
ソードタトゥーＭ,Sword Tattoo M,450,0,,fde533dd6500ccf35dfada2a742963d3,,,,,,,,,,,
,,460,0,,823c739512f55805f9da345a1cfa3e76,,,,,,,,,,,
ディレクトグローブＭ,Director Gloves M,461,0,,97978d663980a4029dd31c75d9cc5eb5,,,,,,,,,,,
ブレイブハンド,Brave Hand,470,0,,17ee30bb4b80bc371bddbb283422f108,,,,,,,,,,,
,,479,0,,2e02445cd4380f7eabe21445af77c7ba,,,,,,,,,,,
フォリーグローブ,Folly Gloves,480,0,,cced9e4c5e120086ba72114bb7697220,,,,,,,,,,,
ハウザースキン,Howzer Skin,490,0,,cfdfdbaec7246f21e471756a661124ae,,,,,,,,,,,
網タイツ＆手袋Ｍ,Fishnet Tights & Gloves M,500,0,,f9c4c6abaad349da877f8a8cc8cd9fbe,,,,,,,,,,,
テオレマードグローブ,Teoremard Gloves,510,0,,34491be3a788f9f16e1abeb6bf1a3ca7,,,,,,,,,,,
イルミナスペイント,Illuminus Paint,520,0,,ea1482b41120d04937d7916643a4564a,,,,,,,,,,,
レッグサポーターＭ黒,Leg Supporters M: Black,530,0,,a1da7f3582e3391955b13c8da3c6ad77,,,,,,,,,,,
レッグサポーターＭ白,Leg Supporters M: White,531,0,,76dc95ed07211d7fb1531d76b301aeda,,,,,,,,,,,
ボディサークルＭ　赤,Body Circle M: Red,540,0,,9e35ce62106900058c47296f2cd1b203,,,,,,,,,,,
ボディサークルＭ　紫,Body Circle M: Purple,541,0,,571b6a99fd2af77ebe53768730bc3aef,,,,,,,,,,,
天星初等部男子ソックス,Tensei Academy Boy Socks,550,0,,f0a8e4223fe5c78a9674b5e5080bedd1,,,,,,,,,,,
リデルグローブＭ,Lidel Gloves M,560,0,,4775fe24bfd574b1eb48b043e86e9dc3,,,,,,,,,,,
ナノブラストペイントＭ黒,Nano Blast Paint M: Black,570,0,,4966e01d13e88aa19bfec4be543482f8,,,,,,,,,,,
ナノブラストペイントＭ灰,Nano Blast Paint M: Gray,571,0,,e93f584aa89a4f397b4b55916ef58384,,,,,,,,,,,
ナノブラストペイントＭ白,Nano Blast Paint M: White,572,0,,8c0ab960459f9da785f869804cc9d336,,,,,,,,,,,
ニーサポーターＭ,Knee Supporters M,580,0,,7469147a33cbe61830df0838d49171bc,,,,,,,,,,,
ボーダーニーハイＭ　白,Striped Thigh-Highs M: White,590,0,,1d6d5741f2a894eb1a717df4b393e04e,,,,,,,,,,,
ボーダーニーハイＭ　赤,Striped Thigh-Highs M: Red,591,0,,1b9a8575f482ec97b8193cbec40048a1,,,,,,,,,,,
ボーダーニーハイＭ　青,Striped Thigh-Highs M: Blue,592,0,,9aeb05b3c8ddc08b79602bf3b0f3d9d4,,,,,,,,,,,
ブレイズペイントＭ　黒,Blaze Paint M: Black,600,0,,c39506c82cf78ae780da9984ebb31746,,,,,,,,,,,
スポーツウェアＭ,Sportswear M,610,0,,40c01754e8ec66056ac0a9cea710aaa8,,,,,,,,,,,
カテドラルタイツＭ　淡,Cathedral Tights M: Light,620,0,,6b8e9e6889ee335c7aca8f05989bef1b,,,,,,,,,,,
カテドラルタイツＭ,Cathedral Tights M,621,0,,f0f4a60c0c9c47f88dff7b8067e01fd6,,,,,,,,,,,
カテドラルタイツＭ　濃,Cathedral Tights M: Dark,622,0,,f28b3d060d00d2dc4be6e523b2b933e7,,,,,,,,,,,
クロームタトゥーＭ　黒,Chrome Tattoo M: Black,630,0,,60f55fa445143287dd4b480dc68a8b68,,,,,,,,,,,
使徒礼装の手甲,Disciple's Gauntlets,640,0,,5345ffd5edf0d6aafeb29ebb4c348721,,,,,,,,,,,
ルーサーの手袋,Luther's Gloves,650,0,,95fd42a551e99ab16f40d4cb891ec4da,,,,,,,,,,,
,,659,0,,1da23cc27e9b3bdc63908e53336e0dd0,,,,,,,,,,,
クエンジットスリーブ,Cuendito Slip,660,0,,3128231be24b49b146e67347ae9c6f71,,,,,,,,,,,
ルインペイントＭ,Ruin Paint M,670,0,,21d91412d784c7242f22a5b97824a580,,,,,,,,,,,
,,679,0,,58a53d4dee01d52bbb8efb1ac2710d42,,,,,,,,,,,
ボーダーニーハイＭ　Ｂ白,Striped Thigh-Highs M B: White,680,0,,2954be8c672d68bc7024c59284c2436f,,,,,,,,,,,
ボーダーニーハイＭ　Ｂ赤,Striped Thigh-Highs M B: Red,681,0,,eb2c4c4405e1378eda63d330f24df578,,,,,,,,,,,
ボーダーニーハイＭ　Ｂ青,Striped Thigh-Highs M B: Blue,682,0,,df871ed7cb91cda76e70bddf6e157762,,,,,,,,,,,
翠玉の手袋,Jasper's Gauntlets,690,0,,58e20c75a634cfcc60ce2db77b7fb2ec,,,,,,,,,,,
レントゲンペイントＭ　Ｂ,X-Ray Paint M B,700,0,,9c47b600a09deb0a54ccf130d8ee330f,,,,,,,,,,,
シュタットバンド,Armwrap,710,0,,9bf9609ee54794e80c5c50cfb40d805f,,,,,,,,,,,
,,719,0,,3e859fcc2135a42ca360362cb135243c,,,,,,,,,,,
ハロウィンサイハイＭ,Halloween Thigh-Highs M,720,0,,105999472cb100687edf02ece0e34219,,,,,,,,,,,
軍手Ｍ,Army Gloves M,730,0,,c5db541e5f0f68be17fd9a36719a4e6b,,,,,,,,,,,
幻創種タトゥーＭ,Phantasm Tattoo M,740,0,,799ac12096e1c00f5da51c7ffe921083,,,,,,,,,,,
エナメル全身タイツＭ　黒,Enamel Body Tights M: Black,750,0,,392b415abaac1db19321bd8c147972bf,,,,,,,,,,,
エナメル全身タイツＭ　白,Enamel Body Tights M: White,751,0,,3da9b65c74bd309d85318738b8f7595b,,,,,,,,,,,
エナメル全身タイツＭ　赤,Enamel Body Tights M: Red,752,0,,4dac2e741d563f8fc523694c9f9f01e2,,,,,,,,,,,
エナメル全身タイツＭ　青,Enamel Body Tights M: Blue,753,0,,0eae3d87339d7da6c4b6617ab7600666,,,,,,,,,,,
ラバータイツＭ　白,Rubber Tights M: White,760,0,,f5be5decac766301614ef15eeef2a1a2,,,,,,,,,,,
ラバータイツＭ　黒,Rubber Tights M: Black,761,0,,56b9738501cdc88edfed76172d363bed,,,,,,,,,,,
ラバータイツＭ　灰,Rubber Tights M: Gray,762,0,,51843d08a4c06d8b11815b59c289ae20,,,,,,,,,,,
ケインペイント,Rhys Paint,770,0,,815044d37957cf9a4e37e750dc9b3185,,,,,,,,,,,
フローのソックスＭ,Florent Socks M,780,0,,b83a9d444662d37214f7f8dfc5824cd4,,,,,,,,,,,
,,789,0,,6e00e151d8dd4a19a456e3fcf7853271,,,,,,,,,,,
スミシータトゥー,Smithy Tattoo,790,0,,b2f17493977f7a114b3bd3f9992de886,,,,,,,,,,,
イロドリグローブＭ,Imbued Gloves M,800,0,,8e6086084cf0632ee5dd619bbbf36321,,,,,,,,,,,
結月ゆかりのソックスＭ,,810,0,,7434d2d1cdd0538f6f937d9cf00db09e,,,,,,,,,,,
結月ゆかりアームカバーＭ,,820,0,,c762e71722f944b7a58549224c863af6,,,,,,,,,,,
リデルグローブＭ　Ｂ,Lidel Gloves M B,830,0,,69026371852a40187599685cfffa0256,,,,,,,,,,,
バルバタトゥーＭ　茶,Barbarian Tattoo M: Brown,840,0,,2f49a16a8ae050d9e212c991c7a77e03,,,,,,,,,,,
バルバタトゥーＭ　白,Barbarian Tattoo M: White,841,0,,a242a4b4b4fe7ae500c4ee3f3b664ddc,,,,,,,,,,,
インナー風ペイントＭ　Ａ白,Innerwear Paint M A: White,850,0,,b1864c3f52277dc2316fce5442522ce0,,,,,,,,,,,
インナー風ペイントＭ　Ａ灰,Innerwear Paint M A: Gray,851,0,,39dca66a49873e8e40ef95c66653e3de,,,,,,,,,,,
インナー風ペイントＭ　Ａ黒,Innerwear Paint M A: Black,852,0,,f658cae18a7cb18fcbc9317694c7c360,,,,,,,,,,,
インナー風ペイントＭ　Ｂ白,Innerwear Paint M B: White,860,0,,0e94a041e41e406da1c088b0b2773135,,,,,,,,,,,
インナー風ペイントＭ　Ｂ灰,Innerwear Paint M B: Gray,861,0,,f91a8c315aaf7d7f4e34f6ea6bb0063e,,,,,,,,,,,
インナー風ペイントＭ　Ｂ黒,Innerwear Paint M B: Black,862,0,,d30c6a03993405f066a97c506ce3590f,,,,,,,,,,,
しましまスーツＭ,Striped Suit M,870,0,,a8706be93da30547e9b7d5eecef42082,,,,,,,,,,,
シンプルチョーカーＭ　Ａ,Simple Choker M A,880,0,,1d9d47e0d13108f7f1a7d7fe9e7492bb,,,,,,,,,,,
シンプルチョーカーＭ　Ｂ,Simple Choker M B,890,0,,926fa3a93233579b04835d14b49d13df,,,,,,,,,,,
シンプルチョーカーＭ　Ｃ,Simple Choker M C,900,0,,298e19074a3e013db1517ed5f44aea3f,,,,,,,,,,,
シンプルチョーカーＭ　Ｄ,Simple Choker M D,910,0,,20831e2b1eea2572a3180100e5084b9f,,,,,,,,,,,
エレメンタルボディ炎Ｍ,Elemental Body Flame M,920,0,,9708089f023d13421fd41e56745fae76,,,,,,,,,,,
エレメンタルボディ水Ｍ,Elemental Body Water M,921,0,,72865907dc617453c5dc14f54e48279a,,,,,,,,,,,
エレメンタルボディ風Ｍ,Elemental Body Wind M,922,0,,e99184f93244b410eaae8b1dc8d9ef41,,,,,,,,,,,
レースチョーカーＭ　白,Laced Choker M: White,930,0,,a09115e8f08e25379e64630a940d360a,,,,,,,,,,,
レースチョーカーＭ　黒,Laced Choker M: Black,931,0,,89de350051362d4fe97210d4a33ecc2f,,,,,,,,,,,
レースチョーカーＭ　赤,Laced Choker M: Red,932,0,,1dab76ca5329ceb2f2147fc4a3155e66,,,,,,,,,,,
ハナヤギニーハイＭ,Brilliant Thigh-Highs M,940,0,,ba8c7a63918820bb9baf1a4f41f4d87b,,,,,,,,,,,
ハナヤギグローブＭ,Brilliant Gloves M,950,0,,b83a9ef5bb0476b128484a7fab1f6c08,,,,,,,,,,,
ヒューイタトゥー,Huey Tattoo,960,0,,e592d0b4770ceb6f241d1d29dc11519a,,,,,,,,,,,
,,969,0,,ac661d06ebbe8b4664728810e767a167,,,,,,,,,,,
クロームタトゥーＭ　紫,Chrome Tattoo M: Purple,970,0,,8160da197a0fecc7339ff80eeab2e80d,,,,,,,,,,,
スポーツウェアＭ　Ｂ,Sportswear M B,980,0,,494fb87b548e15c166b1da83ef2d5379,,,,,,,,,,,
イービルグローブ,Evil Gloves,990,0,,813e42a24c434219fb4555c5442bc40a,,,,,,,,,,,
ノクスカディナグローブ,Nox Cadina Gloves,1000,0,,322189906c2d35eb3b1dca506fa0e230,,,,,,,,,,,
,,1009,0,,89dac8e1d5990a1f7fddce5d0bafb7d6,,,,,,,,,,,
ノクスカディナペイント,Nox Cadina Paint,1010,0,,46f93133c344e261cdf7ee46257e5896,,,,,,,,,,,
,,1019,0,,050d4f175d0a8d98827a4736fcee98d7,,,,,,,,,,,
ニレンカムイサイハイＭ,Twin Kamuy Thigh-Highs M,1020,0,,84903a559497adfd40ad88e550112a14,,,,,,,,,,,
シャルフペイント,Scharf Paint,1030,0,,3b12114abb202cdd21a69758e56d518d,,,,,,,,,,,
,,1039,0,,bb1c4dee49e1319e5bc70f7dc7389cdb,,,,,,,,,,,
妖異包帯,Occultic Bandages,1040,0,,58a2459e24dd55c06c25468e8b32597b,,,,,,,,,,,
ガンボーイタトゥー,Gun Boy Tattoo,1050,0,,ff40750935c1c4835d761843614fe818,,,,,,,,,,,
ネイルカラーＭ　赤,Nail Color M: Red,1060,0,,72cddc7f1de18068b71273e858977006,,,,,,,,,,,
ネイルカラーＭ　青,Nail Color M: Blue,1061,0,,d99fe88ea63be7f2322d1642c58dfea4,,,,,,,,,,,
ネイルカラーＭ　桃,Nail Color M: Pink,1062,0,,eb74b6db375264c00ff342e55d7fc515,,,,,,,,,,,
ネイルカラーＭ　黒,Nail Color M: Black,1063,0,,32fcfd38ef48ff24657784197d40de03,,,,,,,,,,,
ディレクトグローブＭ　Ｂ,Director Gloves M B,1070,0,,7e71432dad1d0928d049611a9316241e,,,,,,,,,,,
草薙京のグローブ,,1080,0,,77e6389295ce601fb150aa3e9c84ac16,,,,,,,,,,,
スミシータトゥーＢ,Smithy Tattoo B,1090,0,,45d462dd69167b1966e72a67bb929a23,,,,,,,,,,,
シンプルチョーカーＭ白Ａ,Simple Choker M: White A,1100,0,,b189259c7308a21d3d5efb9a2aec691d,,,,,,,,,,,
シンプルチョーカーＭ白Ｂ,Simple Choker M: White B,1110,0,,e7f54736e9b0f91ec9c212d3dc50364f,,,,,,,,,,,
シンプルチョーカーＭ白Ｃ,Simple Choker M: White C,1120,0,,b73d04b32e019e6b99ca1a24c22b812f,,,,,,,,,,,
シンプルチョーカーＭ白Ｄ,Simple Choker M: White D,1130,0,,28931ad8d56c4735a609965e5ec81a16,,,,,,,,,,,
ムジンタトゥーＭ,Mujin Tattoo M,1140,0,,f0b7406e8008359a95e7812bf9f34f49,,,,,,,,,,,
イロドリグローブＭ　Ｂ,Imbued Gloves M B,1150,0,,4caffccd6fcc30b835f133c4b2658920,,,,,,,,,,,
ハナヤギグローブＭ　Ｂ,Brilliant Gloves M B,1160,0,,c1086e9387cbe052167fe5bb6f17e87e,,,,,,,,,,,
ハナヤギニーハイＭ　Ｂ,Brilliant Thigh-Highs M B,1170,0,,827ab3c41a1f9fae74618513de9e59cf,,,,,,,,,,,
ハートタトゥーＭ　Ｂ,Heart Tattoo M B,1180,0,,a316765d4b188e111e587c2b843681a8,,,,,,,,,,,
ブラックローズタトゥーＭ,Black Rose Tattoo M,1190,0,,d966fb5b7f27e5efcaeb690dedbadad3,,,,,,,,,,,
アギニスタトゥーＭ　Ｂ,Agnis Tattoo M B,1200,0,,7315f854f2933e80a4076ba7b38392ae,,,,,,,,,,,
インユウ手袋,Inyuu Gloves,1210,0,,516e85cf47eaecd98ca9be2b2b3dfe15,,,,,,,,,,,
フローのソックスＭ　Ｂ,Florent Socks M B,1220,0,,a0bf4cfa3f6129d50124ba6d0ec2960a,,,,,,,,,,,
レースチョーカーＭ　紺,Laced Choker M: Navy,1230,0,,7a9736fc5377dbc8d9b8089564acac3d,,,,,,,,,,,
ニレンカムイサイハイＭ　Ｂ,Twin Kamuy Thigh-Highs M B,1240,0,,189ebcd779dc9ed2a364c549949047d7,,,,,,,,,,,
レナートペイント,Renato Paint,1250,0,,adc4b444ecd3f59076df64daecf022a2,,,,,,,,,,,
,,1259,0,,87d53cd9009498adaa1763c107495030,,,,,,,,,,,
心の鍵穴Ｍ,Heart Keyhole M,1260,0,,3888c5cfd11f1a2ec283c5750e4e1bf9,,,,,,,,,,,
シャルフペイントＢ,Scharf Paint B,1270,0,,0af2e850f0582c9f2763c7f385e470bb,,,,,,,,,,,
ハロウィンサイハイＭ　Ｂ,Halloween Thigh-Highs M B,1280,0,,277637a70614c45b3140a618fa0dfe01,,,,,,,,,,,
￥GH440アニメ用　男性版　のタイツ,Élégante Tights M,1290,0,,c6268083f75149a0cbd30e2e3c0bcf8a,,,,,,,,,,,
￥チョコカラー衣装(バレンタイン男性)　の靴下,Praline Socks,1300,0,,15ae5849fc0967a6af4b4d37abe6f872,,,,,,,,,,,
クロームタトゥーＭ　水,Chrome Tattoo M: Water,1310,0,,d71041c4316415dec266e177720a0421,,,,,,,,,,,
ネイルカラーＭ　白,Nail Color M: White,1320,0,,774e601996fcfb20c4b19d54179a7aad,,,,,,,,,,,
ネイルカラーＭ　金,Nail Color M: Gold,1330,0,,0039ed2b18b14c9e373aab6aebfb5aac,,,,,,,,,,,
妖異包帯Ｂ,Occultic Bandages B,1340,0,,656c558c01af03c21bf9c6eac348dbb5,,,,,,,,,,,
￥チョコカラー衣装(バレンタイン男性)　の手袋,Praline Gloves,1350,0,,50c1dde3ba3b038651ca3d94cdda1da1,,,,,,,,,,,
￥アニメ用　マトイ　普段着コスチューム　男性版　のニーハイ,Easy Thigh-Highs M,1360,0,,d963e741c988b3c27b055d46ff17bc30,,,,,,,,,,,
￥ガンボーイタトゥー　ＴＶ２,Gun Boy Tattoo B,1370,0,,d4cf90283c9a06740eea8aebbd68daae,,,,,,,,,,,
ゲザングタトゥー,Gesang Tattoo,1380,0,,a4def77eae8b12998273d972fcc550e6,,,,,,,,,,,
ゲザングメッシュ,Gesang Mesh,1390,0,,cbb95e5c921fc85115d506457edfaed7,,,,,,,,,,,
ムジンタトゥーＭ　Ｂ,Mujin Tattoo M B,1400,0,,e3b7271797d309e58c103826fd99f324,,,,,,,,,,,
ムーンタトゥーＭ　Ｂ,Moon Tattoo M B,1410,0,,e1a729c71ffdacf628c2b598f1b947a3,,,,,,,,,,,
スポーツウェアＭ　Ｃ,Sportswear M C,1420,0,,4cbf5fe8605c2517e97b0147e3966c36,,,,,,,,,,,
レース風ヘナタトゥーＭ　白,Lace Henna Tattoo M: White,1430,0,,2316796db7864e4015e026d5342d9aa5,,,,,,,,,,,
レース風ヘナタトゥーＭ　黒,Lace Henna Tattoo M: Black,1431,0,,46056dda71567afddc1fbf033ed672d2,,,,,,,,,,,
レース風ヘナタトゥーＭ　金,Lace Henna Tattoo M: Gold,1432,0,,2c886bb3c676a2c7918ca446b379b1d7,,,,,,,,,,,
ドラゴンタトゥー　白,Dragon Tattoo: White,1440,0,,89a5f5088281ad58ec4cf063feaa3526,,,,,,,,,,,
ドラゴンタトゥー　黒,Dragon Tattoo: Black,1441,0,,9168aa7e03632ea0f505f641c1849674,,,,,,,,,,,
ドラゴンタトゥー　赤,Dragon Tattoo: Red,1442,0,,5a88ed7bac9f81ef2024c2279a92cbea,,,,,,,,,,,
ドラゴンタトゥー　青,Dragon Tattoo: Blue,1443,0,,536c427e3a091ba240325fd67b6e8baa,,,,,,,,,,,
アームラップリボンＭ　黒,Arm Wrap Ribbon M: Black,1450,0,,c44138e5f083cab2d2c5ee60547000ad,,,,,,,,,,,
アームラップリボンＭ　白,Arm Wrap Ribbon M: White,1451,0,,5b6fbf3695c39bc4b3722ab8c40f694e,,,,,,,,,,,
アームラップリボンＭ　赤,Arm Wrap Ribbon M: Red,1452,0,,6d1b15f67bff97d023b87401e1c99caf,,,,,,,,,,,
アームラップリボンＭ　青,Arm Wrap Ribbon M: Blue,1453,0,,d57711bac1e052cc15bdcf8d36fef671,,,,,,,,,,,
インユウ手袋Ｂ,Inyuu Gloves B,1460,0,,7ad810b61b3038f98eb375d9a92c53bb,,,,,,,,,,,
ニレンカムイサイハイＭ　Ｃ,Twin Kamuy Thigh-Highs M C,1470,0,,6bf32d4f1796b9bb5715b0d20c1d0fed,,,,,,,,,,,
アーガイル風靴下Ｍ　赤,Argyle Socks M: Red,1480,0,,5a6e2d209288b35e84c7ec64b0177286,,,,,,,,,,,
アーガイル風靴下Ｍ　黒,Argyle Socks M: Black,1481,0,,5a9d6258f1ba7512f61f7a2832122087,,,,,,,,,,,
アーガイル風靴下Ｍ　水,Argyle Socks M: Water,1482,0,,a3ef898fb922932b9e3fe654b504daa6,,,,,,,,,,,
アーガイル風靴下Ｍ　桃,Argyle Socks M: Pink,1483,0,,9086ce39c7c7a63b6cf5d32393e6b084,,,,,,,,,,,
ワイドチョーカーＭ　黒,Wide Choker M: Black,1490,0,,22d227579ce2dfc1aa8b4f41ffd7110f,,,,,,,,,,,
ワイドチョーカーＭ　白,Wide Choker M: White,1491,0,,161e970a019e6fb8e0654d08ec26695f,,,,,,,,,,,
ワイドチョーカーＭ　赤,Wide Choker M: Red,1492,0,,721f28f312f8e1f7596a9728ebf72c02,,,,,,,,,,,
紲星あかりのタイツＭ,,1500,0,,b1779c30cf297b587f6a2f2010472802,,,,,,,,,,,
紲星あかりアームカバーＭ,,1510,0,,1b75bfc361f6c9e7c9368273649412c4,,,,,,,,,,,
イージーサイハイＭ　Ｂ,Easy Thigh-Highs M B,1520,0,,50e6fd48f1d5f6d3c15be06ab33ff1d1,,,,,,,,,,,
エレガンテタイツＭ　Ｂ,Élégante Tights M B,1530,0,,d78a173553586068ec5b67f10f8424df,,,,,,,,,,,
ルインペイントＭ　Ｂ,Ruin Paint M B,1540,0,,e3134502a6c25b36afa762bc1e145140,,,,,,,,,,,
,,9990,0,,,,,,,,,,,,,
